{"run":63,"commit":"85d66b0","metric":1.43986316,"metrics":{"peak_memory_mb":1479,"step_avg_ms":188.85,"steps":1589,"submission_bytes":8173524,"train_loss":2.77,"train_time_ms":300078},"status":"discard","description":"MUON_WD=0.04 on full best config. BPB 1.43986 vs 1.41184 (+0.028). Catastrophic. Confirms default 0.095 is best.","timestamp":1777470173568,"segment":1,"confidence":4.398407677625999,"iterationTokens":1699,"asi":{"delta_bpb":0.02803,"hypothesis":"MUON_WD=0.04 on SP1892 int6_rans+MLP3+embed_lr=0.3. MASSIVELY worse. Default 0.095 was already optimal. This confirms the autoresearch.md finding."}}
{"run":64,"commit":"85d66b0","metric":1.41983167,"metrics":{"peak_memory_mb":1479,"step_avg_ms":187.96,"steps":1597,"submission_bytes":8111851,"train_loss":2.7599,"train_time_ms":300176},"status":"discard","description":"PRELUDE_NORM=1 on SP1892 best config. BPB 1.41983 vs 1.41184 (+0.008). Norm in prelude hurts.","timestamp":1777471665530,"segment":1,"confidence":4.189909412902123,"iterationTokens":589,"asi":{"hypothesis":"PRELUDE_NORM=1 adds norm to prelude layers. Slightly worse (1.4198 vs 1.4118)."}}
{"run":65,"commit":"8552555","metric":1.40788208,"metrics":{"peak_memory_mb":1479,"step_avg_ms":179.53,"steps":1672,"submission_bytes":8127907,"train_loss":2.6806,"train_time_ms":300174},"status":"keep","description":"LIGER_ROPE=1 on SP1892 int6_rans+MLP3+embed_lr=0.3. BPB 1.40788 vs 1.41184 (-0.004). Steps 1672 vs 1593, step time 179ms vs 188ms. Liger kernel improves RoPE efficiency and numerical stability. New best.","timestamp":1777477228061,"segment":1,"confidence":4.229485157260405,"iterationTokens":2551,"asi":{"delta_bpb":-0.00396,"hypothesis":"LIGER_ROPE=1 uses Liger kernel's optimized RoPE implementation. Faster, better numerics, more steps in 300s"}}
{"run":66,"commit":"a2ef514","metric":1.40691286,"metrics":{"peak_memory_mb":1479,"step_avg_ms":178.36,"steps":1682,"submission_bytes":8127240,"train_loss":2.6878,"train_time_ms":300010},"status":"keep","description":"CODA_MOE_NUM_EXPERTS=4 TOP_K=1 MLP_MULT=3 on SP1892 int6_rans+LIGER_ROPE. BPB 1.40691 vs 1.40788 (-0.001). Artifact unchanged (8.13MB). Keep.","timestamp":1777478015539,"segment":1,"confidence":3.929213289284585,"iterationTokens":1133,"asi":{"delta_bpb":-0.00097,"hypothesis":"CODA_MOE_NUM_EXPERTS=4 TOP_K=1 on SP1892 int6_rans. Adds minimal params but improves expressiveness of coda output projection."}}
{"run":67,"commit":"a2ef514","metric":1.41524555,"metrics":{"peak_memory_mb":1479,"step_avg_ms":178.39,"steps":1682,"submission_bytes":8085465,"train_loss":2.6981,"train_time_ms":300051},"status":"discard","description":"HEAD_LR=0.004 on SP1892 best config. BPB 1.41525 vs 1.40691 (+0.008). Lower head LR hurts.","timestamp":1777478826127,"segment":1,"confidence":3.6111954518394933,"iterationTokens":1173,"asi":{"hypothesis":"HEAD_LR=0.004 (vs default 0.008). Lower head output LR hurt for SP1892"}}
{"run":68,"commit":"a2ef514","metric":1.41196075,"metrics":{"peak_memory_mb":1601,"step_avg_ms":182.76,"steps":1642,"submission_bytes":8118655,"train_loss":2.6825,"train_time_ms":300098},"status":"discard","description":"XSA_LAST_N=2 on SP1892 int6_rans+CODA_MOE+LIGER_ROPE. BPB 1.41196 vs 1.40691 (+0.005). Slower (182ms vs 178ms). Discard.","timestamp":1777479690387,"segment":1,"confidence":2.773963394635142,"iterationTokens":831,"asi":{"hypothesis":"XSA_LAST_N=2 on SP1892 best config. Attn-residual mode on last 2 core blocks. Slightly worse BPB, compile re-kick cost visible in longer eval time."}}
{"run":69,"commit":"a2ef514","metric":1.41541838,"metrics":{"peak_memory_mb":1479,"step_avg_ms":178.47,"steps":1681,"submission_bytes":8076875,"train_loss":2.7018,"train_time_ms":300010},"status":"discard","description":"CODA_MOE_NUM_EXPERTS=8 (vs 4). BPB 1.41542 vs 1.40691 (+0.009). More experts is not better here. Keep 4.","timestamp":1777482434768,"segment":1,"confidence":2.5460894507498506,"iterationTokens":1265,"asi":{"hypothesis":"CODA_MOE_NUM_EXPERTS=8 on SP1892 int6_rans best config. Worse than experts=4, likely due to overhead or more difficult training dynamics."}}
{"run":70,"commit":"a2ef514","metric":1.41069331,"metrics":{"peak_memory_mb":1395,"step_avg_ms":173.24,"steps":1732,"submission_bytes":8126358,"train_loss":2.7314,"train_time_ms":300059},"status":"discard","description":"PARALLEL_RESIDUAL_IMPL=delayed on SP1892 best config. BPB 1.41069 vs immediate 1.40691 (+0.004). Delayed implementation doesn't help. Discard.","timestamp":1777483397962,"segment":1,"confidence":2.5212595902851334,"iterationTokens":334,"asi":{"hypothesis":"PARALLEL_RESIDUAL_IMPL=delayed with RECORD_CONTROLS=0. Slightly worse than immediate impl (1.411 vs 1.407)."}}
{"run":71,"commit":"a2ef514","metric":1.41793978,"metrics":{"peak_memory_mb":1612,"step_avg_ms":190.97,"steps":1572,"submission_bytes":9094565,"train_loss":2.752,"train_time_ms":300200},"status":"discard","description":"POE_NUM_EXPERTS=3 on SP1892 int6_rans. BPB 1.41794 vs POE=1 1.40691 (+0.011). Slower (191ms), larger artifact (9.1MB). POE irrelevant on SP1892.","timestamp":1777484932540,"segment":1,"confidence":2.6380475456642016,"iterationTokens":1064,"asi":{"artifact_mb":9.09,"hypothesis":"POE_NUM_EXPERTS=3 on SP1892 int6_rans best config. Worse than POE=1 (1.418 vs 1.407). POE not helpful on SP1892."}}
{"run":72,"commit":"a2ef514","metric":1.42484891,"metrics":{"peak_memory_mb":1246,"step_avg_ms":219.09,"steps":1370,"submission_bytes":9224978,"train_loss":2.7862,"train_time_ms":300155},"status":"discard","description":"GRADIENT_CHECKPOINTING=1 + MLP_MULT=4 on SP1892 int6_rans. BPB 1.42485 vs 1.40691 (+0.018). Step time 219ms, only 1370 steps. Gradient checkpoint overhead not worth it.","timestamp":1777487278219,"segment":1,"confidence":2.6450898871163084,"iterationTokens":364,"asi":{"hypothesis":"Gradient checkpointing + larger MLP on SP1892. Hoped to fit MLP4 but checkpoint overhead killed throughput."}}
{"run":73,"commit":"a2ef514","metric":1.43921079,"metrics":{"peak_memory_mb":2179,"step_avg_ms":268.71,"steps":1117,"submission_bytes":8150024,"train_loss":2.7302,"train_time_ms":300151},"status":"discard","description":"TRAIN_BATCH_TOKENS=196608 on SP1892 int6_rans. BPB 1.43921 vs 131072's 1.40691 (+0.032). Step time 269ms vs 178ms. Much worse. Keep 131072.","timestamp":1777488855534,"segment":1,"confidence":2.6380475456642016,"iterationTokens":551,"asi":{"hypothesis":"TRAIN_BATCH_TOKENS=196608 on SP1892 int6_rans. Step time 269ms, only 1117 steps. Too large batch hurts throughput-BPB tradeoff on SP1892."}}
{"run":74,"commit":"a2ef514","metric":1.53021406,"metrics":{"steps":910,"step_avg_ms":329.91,"submission_bytes":8119492,"train_loss":2.9621,"peak_memory_mb":2271,"train_time_ms":300217},"status":"discard","description":"ATTENTION_WINDOW=128 on SP1892 int6_rans best config. BPB 1.530 vs 1.407 (+0.123). Step time 330ms, only 910 steps. Local attention window badly hurts for 1024 seq length. Discard.","timestamp":1777489859420,"segment":1,"confidence":2.5212595902851334,"iterationTokens":1794,"asi":{"hypothesis":"Sliding attention window 128 on seq_len=1024. Catastrophic underfitting.","delta_bpb":0.1233}}
{"run":75,"commit":"a2ef514","metric":0,"metrics":{"steps":1428,"step_avg_ms":210.18,"submission_bytes":10053226,"train_loss":0.0003,"peak_memory_mb":1572,"train_time_ms":300142},"status":"crash","description":"SP4096 tokenizer test — data path nested as datasets/datasets/fineweb10B_sp4096. BPB 6.28, train_loss 0.0003 (near zero). Data format incompatible or path wrong. Need correct SP4096 data path.","timestamp":1777491656442,"segment":1,"confidence":2.5212595902851334,"iterationTokens":1216,"asi":{"hypothesis":"SP4096 data path issue — datasets/datasets/ nesting, wrong format","rollback_reason":"BPB 6.28 indicates data format mismatch","next_action_hint":"Find correct SP4096 data path before retrying"}}
{"run":76,"commit":"ad6b678","metric":1.40359509,"metrics":{"steps":1515,"step_avg_ms":198.06,"submission_bytes":10459681,"train_loss":2.7157,"peak_memory_mb":1678,"train_time_ms":300055},"status":"keep","description":"N_LAYERS_IN_CODA=3 on SP1892 int6_rans+CODA_MOE+LIGER_ROPE. BPB 1.40360 vs coda=2's 1.40691 (-0.003). Step time 198ms (slower from extra layer), 1515 steps. Better quality BPB justifies throughput cost. Artifact 10.5MB (<16MB ceiling).","timestamp":1777492554581,"segment":1,"confidence":2.8440733763739394,"iterationTokens":1174,"asi":{"delta_bpb":-0.00332,"hypothesis":"Third coda layer improves output projection quality. With only 2 coda layers before, model underfits output representation.","artifact_mb":10.46}}
{"run":77,"commit":"b394704","metric":1.40189793,"metrics":{"steps":1513,"step_avg_ms":198.41,"submission_bytes":10416051,"train_loss":2.7113,"peak_memory_mb":1678,"train_time_ms":300187},"status":"keep","description":"ROPE_DIMS=64 on SP1892 int6_rans+coda3+coda_moe4. BPB 1.40190 vs ROPE_DIMS=32's 1.40360 (-0.0017). More RoPE dimensions help for seq1024. Artifact 10.4MB (under 16MB). New best!","timestamp":1777494366362,"segment":1,"confidence":2.702765910194921,"iterationTokens":1897,"asi":{"delta_bpb":-0.0017,"hypothesis":"ROPE_DIMS=64 (was 32) for seq_len=1024. More rotary dimensions improve positional encoding expressiveness, reducing BPB.","artifact_mb":10.42}}
{"run":78,"commit":"a51d2c2","metric":1.39905976,"metrics":{"steps":1638,"step_avg_ms":183.25,"submission_bytes":9541430,"train_loss":2.6529,"peak_memory_mb":1549,"train_time_ms":300170},"status":"keep","description":"RECURRENT_INTERMEDIATE_DIM=512 (vs default mlp_mult*recurrent_dim=1152) on SP1892 int6_rans+coda3+rope64+LIGER_ROPE. BPB 1.39906 vs 1.40190 (-0.003). Smaller recurrent MLP reduces params, speeds steps (183ms vs 198ms), more steps (1638 vs 1513), lower memory (1549MB). Huge win!","timestamp":1777496011715,"segment":1,"confidence":2.802362431349382,"iterationTokens":437,"asi":{"delta_bpb":-0.00284,"hypothesis":"RECURRENT_INTERMEDIATE_DIM=512 overrides MLP_MULT*384=1152. Smaller recurrent hidden dim speeds steps and improves quality. Artifact 9.5MB (<16MB)","artifact_mb":9.54}}
{"run":79,"commit":"4044a3c","metric":1.39997649,"metrics":{"steps":1630,"step_avg_ms":184.08,"submission_bytes":9542942,"train_loss":2.6499,"peak_memory_mb":1550,"train_time_ms":300052},"status":"keep","description":"Reconfirm best config (RECURRENT_INTERMEDIATE_DIM=512, SP1892 int6_rans, coda3, rope64, LIGER_ROPE, CODA_MOE=4). BPB 1.39998 vs 1.39906 (within noise). Config is stable and solid.","timestamp":1777496762256,"segment":1,"confidence":2.949540722495069,"iterationTokens":2081,"asi":{"hypothesis":"Reconfirming RECURRENT_INTERMEDIATE_DIM=512 best config","delta_bpb":0.0009,"notes":"within noise floor, config confirmed stable"}}
{"run":80,"commit":"26d20b4","metric":0,"metrics":{"peak_memory_mb":0,"step_avg_ms":0,"steps":0,"submission_bytes":0,"train_loss":0,"train_time_ms":0},"status":"crash","description":"Attempted current 10min CaseOps/SP8192 large-batch config; crashed quickly with CUDA OOM because another process plus this run exhausted 80GB and batch=1,048,576 needs > remaining memory.","timestamp":1777597697211,"segment":1,"confidence":2.949540722495069,"asi":{"hypothesis":"10min run with CaseOps/SP8192 and very large batch may lower BPB via much more token throughput, with TTT disabled.","rollback_reason":"CUDA OOM allocating 2.25GiB during compiled forward; GPU also had another process using ~19.7GiB, but active run used ~59GiB so batch too aggressive for clean 80GB too.","next_action_hint":"Reduce TRAIN_BATCH_TOKENS substantially (e.g. 786432 or 524288) and check for stale GPU processes before rerunning."}}
{"run":81,"commit":"26d20b4","metric":0,"metrics":{"peak_memory_mb":0,"step_avg_ms":0,"steps":0,"submission_bytes":0,"train_loss":0,"train_time_ms":0},"status":"crash","description":"Retry of current 10min CaseOps/SP8192 batch=1,048,576 config after GPU freed; still OOM on single 80GB (run reached ~78.7GB before failing). Batch too high for this shape.","timestamp":1777597787266,"segment":1,"confidence":2.949540722495069,"asi":{"hypothesis":"With GPU memory free, batch=1,048,576 might fit and give best token throughput for 10min CaseOps/SP8192.","rollback_reason":"CUDA OOM even with no competing process; single run used 78.67GiB and failed allocating another 768MiB.","next_action_hint":"Lower TRAIN_BATCH_TOKENS to 786432 or 524288; keep TTT off and same tokenizer/export path."}}
{"run":82,"commit":"26d20b4","metric":0,"metrics":{"peak_memory_mb":0,"step_avg_ms":0,"steps":0,"submission_bytes":0,"train_loss":0,"train_time_ms":0},"status":"crash","description":"Aborted by user before measurable result after lowering CaseOps/SP8192 batch to 786432 for OOM recovery.","timestamp":1777597837939,"segment":1,"confidence":2.949540722495069,"asi":{"hypothesis":"Lower batch to 786432 should fit single 80GB while preserving high token throughput for 10min run.","rollback_reason":"User interrupted immediately to ask why batch was lowered; no training result obtained.","next_action_hint":"Explain OOM-driven batch reduction; then continue with largest fitting batch or restore if user wants to test with more memory/headroom."}}
{"run":83,"commit":"1f10273","metric":0,"metrics":{"peak_memory_mb":17434,"step_avg_ms":134.58,"steps":4459,"submission_bytes":13315270,"train_loss":2.4726,"train_time_ms":600088},"status":"crash","description":"8xH100 CaseOps/SP8192 600s balanced run trained successfully to 4459 steps and pre-quant val_bpb 1.2303, but failed official wallclock audit because quant/export pushed training_phase_wallclock to 639s > 600s cap before final roundtrip metric.","timestamp":1777598580714,"segment":1,"confidence":2.949540722495069,"asi":{"hypothesis":"8xH100 CaseOps/SP8192 balanced profile with batch=1,048,576 and TTT off will exploit full cluster throughput and lower BPB substantially.","rollback_reason":"Training reached wallclock cap before export, then quant/export made training_phase_wallclock 639043ms and script raised before final roundtrip exact line; no primary metric per contract.","next_action_hint":"Set MAX_WALLCLOCK_SECONDS around 560 to reserve ~40s for quant/export while keeping wrapper timeout around 750s; keep 8-GPU torchrun and same promising config."}}
{"run":84,"commit":"1f10273","metric":0,"metrics":{"peak_memory_mb":17434,"step_avg_ms":127.99,"steps":4376,"submission_bytes":13317420,"train_loss":2.508,"train_time_ms":560089},"status":"crash","description":"8xH100 CaseOps/SP8192 with MAX_WALLCLOCK_SECONDS=560 still failed official wallclock audit: trained 4376 steps, pre-quant val_bpb 1.2302, but quant/export made training_phase_wallclock 598.6s > 560s cap.","timestamp":1777599243454,"segment":1,"confidence":2.949540722495069,"asi":{"hypothesis":"Reserve 40s for int6_rans grouped export by stopping training at 560s while preserving most of the 600s budget.","rollback_reason":"Official cap in script is the configured MAX_WALLCLOCK_SECONDS, so lowering the cap to 560 made audit compare against 560 rather than the desired 600; export still caused failure before final roundtrip metric.","next_action_hint":"Need a separate training stop target vs official cap, or set MAX_WALLCLOCK_SECONDS=600 and add internal export reserve/stop margin in code/harness."}}
{"run":85,"commit":"13b7e01","metric":1.28024072,"metrics":{"steps":4333,"step_avg_ms":128.09,"submission_bytes":13313708,"train_loss":2.6068,"peak_memory_mb":17434,"train_time_ms":555014},"status":"keep","description":"8xH100 CaseOps/SP8192 with torchrun, 600s official cap and 45s export reserve (train stops ~555s), TTT/context mixers off. Final int6_rans grouped roundtrip BPB 1.28024, huge improvement over prior local best.","timestamp":1777599914617,"segment":1,"confidence":11.280963124347748,"asi":{"hypothesis":"Use all 8 H100s with CaseOps/SP8192, large global batch 1,048,576, and explicit export reserve so final quantized roundtrip fits under 600s training budget."}}
{"run":86,"commit":"6d36524","metric":1.28164498,"metrics":{"steps":4403,"step_avg_ms":127.19,"submission_bytes":13317567,"train_loss":2.6271,"peak_memory_mb":17434,"train_time_ms":560011},"status":"discard","description":"EXPORT_RESERVE_SECONDS 45→40 to train 5s longer under 600s official cap. It passed but BPB worsened 1.28024→1.28164 despite +70 steps; keep 45s reserve/better SWA endpoint.","timestamp":1777600562198,"segment":1,"confidence":10.331343836662885,"asi":{"hypothesis":"A smaller export reserve (40s) allows slightly more training steps and may reduce BPB if previous 45s reserve stopped too early.","rollback_reason":"Primary metric worsened by +0.00140 BPB; more steps did not help, likely SWA/warmdown endpoint or noise.","next_action_hint":"Restore 45s reserve; tune model/optimizer rather than simply using the extra 5s."}}
{"run":87,"commit":"1471a9d","metric":1.28594273,"metrics":{"steps":4469,"step_avg_ms":124.19,"submission_bytes":12584297,"train_loss":2.4871,"peak_memory_mb":16659,"train_time_ms":555004},"status":"discard","description":"8xH100 CaseOps/SP8192 RECURRENT_INTERMEDIATE_DIM 1536→1024 with 45s export reserve. Faster and smaller, but BPB worsened 1.28024→1.28594, so recurrent MLP capacity matters in CaseOps 10min.","timestamp":1777601211927,"segment":1,"confidence":9.911422792452095,"asi":{"hypothesis":"Smaller recurrent intermediate dim (1024) may improve throughput and artifact efficiency, as a similar reduction helped SP1892 local runs.","rollback_reason":"Primary BPB worsened by +0.00570 despite +136 steps and smaller artifact; CaseOps/SP8192 needs the 1536 recurrent MLP width.","next_action_hint":"Restore 1536; try capacity additions elsewhere (coda/MODEL_DIM) or optimizer/SWA tuning."}}
{"run":88,"commit":"e9540f3","metric":1.27998751,"metrics":{"steps":4326,"step_avg_ms":128.32,"submission_bytes":13311013,"train_loss":2.6058,"peak_memory_mb":17434,"train_time_ms":555109},"status":"keep","description":"ROPE_DIMS 32→64 on 8xH100 CaseOps/SP8192 best config. Slight BPB improvement 1.28024→1.27999 with similar steps/artifact; keep as new best.","timestamp":1777601843603,"segment":1,"confidence":9.698331691960064,"asi":{"hypothesis":"More RoPE dimensions (64) may improve positional encoding for seq1024 CaseOps/SP8192, mirroring the SP1892 coda3 gain."}}
{"run":89,"commit":"780ca40","metric":1.28115893,"metrics":{"steps":4377,"step_avg_ms":126.8,"submission_bytes":13308229,"train_loss":2.5109,"peak_memory_mb":17434,"train_time_ms":555021},"status":"discard","description":"ROPE_DIMS 64→96 on 8xH100 CaseOps/SP8192. Faster/slightly smaller, but BPB worsened 1.27999→1.28116; 64 is better local optimum.","timestamp":1777602468196,"segment":1,"confidence":9.416768823048985,"asi":{"hypothesis":"ROPE_DIMS=96 may further improve long-context positional expressiveness beyond 64.","rollback_reason":"Primary BPB worsened by +0.00117 despite more steps; over-rotating or noise; keep ROPE_DIMS=64.","next_action_hint":"Try ROPE_DIMS=48 or tune other hyperparams around ROPE_DIMS=64."}}
{"run":90,"commit":"c09a4e9","metric":1.26783324,"metrics":{"steps":3958,"step_avg_ms":140.23,"submission_bytes":16262242,"train_loss":2.6593,"peak_memory_mb":17470,"train_time_ms":555018},"status":"keep","description":"BIGRAM_HASH_HEADS 4→8 on 8xH100 CaseOps/SP8192+ROPE64. Strong BPB improvement 1.27999→1.26783 despite slower steps and larger 16.26MB artifact; keep because sole objective is minimum val_bpb.","timestamp":1777603102739,"segment":1,"confidence":9.94804761219157,"asi":{"hypothesis":"More bigram hash heads add lexical/context capacity useful for CaseOps/SP8192 byte prediction, and 8xH100 10min budget can absorb the throughput/artifact cost."}}
{"run":91,"commit":"1300b06","metric":1.25791631,"metrics":{"steps":3582,"step_avg_ms":154.96,"submission_bytes":22159622,"train_loss":2.7749,"peak_memory_mb":17534,"train_time_ms":555065},"status":"keep","description":"BIGRAM_HASH_BUCKETS 8192→16384 with 8 hash heads. Major BPB improvement 1.26783→1.25792 despite slower throughput and 22.2MB artifact; user objective is absolute minimum BPB, so keep.","timestamp":1777603746614,"segment":1,"confidence":10.27571823421199,"asi":{"hypothesis":"Increasing bigram hash bucket capacity with 8 heads reduces hash collisions and improves CaseOps/SP8192 lexical prediction enough to outweigh fewer steps."}}
{"run":92,"commit":"bb75154","metric":1.25884624,"metrics":{"steps":3359,"step_avg_ms":165.23,"submission_bytes":28045187,"train_loss":2.6248,"peak_memory_mb":17602,"train_time_ms":555016},"status":"discard","description":"BIGRAM_HASH_HEADS 8→12 at 16384 buckets. BPB worsened 1.25792→1.25885 and artifact grew to 28MB; 8 heads is better.","timestamp":1777604398961,"segment":1,"confidence":10.044261718054216,"asi":{"hypothesis":"More hash heads (12) may add useful n-gram capacity beyond 8 at 16384 buckets.","rollback_reason":"Primary BPB worsened by +0.00093 with much slower steps and bigger artifact; 12 heads over-capacity/throughput tradeoff is worse.","next_action_hint":"Keep 8 heads; explore bucket count or hash dim rather than more heads."}}
{"run":93,"commit":"4c60b44","metric":0,"metrics":{"steps":2943,"step_avg_ms":188.61,"submission_bytes":45756810,"train_loss":2.6209,"peak_memory_mb":17794,"train_time_ms":555069},"status":"crash","description":"BIGRAM_HASH_BUCKETS 16384→32768 with 8 heads. Trained but export grew huge (45.8MB) and exceeded 600s training wallclock after export (613.8s), no final roundtrip metric.","timestamp":1777605050545,"segment":1,"confidence":10.044261718054216,"asi":{"hypothesis":"More hash buckets (32768) may further reduce collisions and lower BPB beyond 16384.","rollback_reason":"Export/serialization became much slower and too large, causing official wallclock failure; step throughput also collapsed after ~2000 steps. No valid primary metric.","next_action_hint":"Keep 16384 buckets; if testing 32768 again use larger export reserve, but likely not worth huge artifact/throughput cost."}}
