{"run":32,"commit":"c39394b","metric":1.42352641,"metrics":{"steps":1340,"step_avg_ms":215.08,"submission_bytes":12569752,"train_loss":2.345,"peak_memory_mb":1600,"train_time_ms":288211},"status":"keep","description":"GPTQ_ENABLED=1 on top of SWA baseline. BPB 1.42353 vs 1.42747 (-0.004). Small but clean win. Artifact size barely changed (12.57MB vs 12.56MB). GPTQ gives slightly better int8 quantization than naive per-tensor via blockwise Hessian-based quant.","timestamp":1777358972637,"segment":0,"confidence":2.755314336211602,"iterationTokens":1820,"asi":{"hypothesis":"Post-training GPTQ improves int8 quantization accuracy vs naive zlib roundtrip","gptq_reserve_time_s":12,"delta_bpb":-0.004,"notes":"Training got 1340 steps (88s short of 300s cap because GPTQ eats ~12s reserve). Net win even with fewer steps."}}
{"run":33,"commit":"c39394b","metric":1.42712772,"metrics":{"steps":1390,"step_avg_ms":215.86,"submission_bytes":12562399,"train_loss":2.3575,"peak_memory_mb":1616,"train_time_ms":300040},"status":"discard","description":"QAT_BITS=6 QAT_START_STEP=500 without changing export bits. BPB 1.42713 vs 1.42353 GPTQ best (+0.004 worse). Artifact still int8+zlib (12.56MB) — QAT_BITS only affects fake-quant during training, not export. Without lowering QUANT_BITS to 6 the artifact stays the same size. Need to combine with QUANT_BITS=6 to realize size savings + enable larger model.","timestamp":1777359606937,"segment":0,"confidence":3.5943140206530937,"iterationTokens":2184,"asi":{"hypothesis":"QAT@6 alone with int8 export","result":"no-op improvement; QAT adapts weights for 6-bit but still exports as int8","rollback_reason":"QAT alone doesn't shrink artifact nor help BPB","next_action_hint":"Try QAT_BITS=6 QUANT_BITS=6 to actually export 6-bit and shrink artifact. Then scale MODEL_DIM up."}}
{"run":34,"commit":"c39394b","metric":0,"metrics":{"steps":1362,"train_loss":2.3441,"step_avg_ms":211.57,"peak_memory_mb":1588,"submission_bytes":12562847,"train_time_ms":288154},"status":"crash","description":"NGRAM eval mixer w/ GPTQ hit 600s wrapper timeout. Training finished at 300s wallclock cap (base BPB 1.42441) but sliding+ngram eval didn't complete.","timestamp":1777370359228,"segment":0,"confidence":3.5943140206530937,"iterationTokens":2184,"asi":{"hypothesis":"NGRAM_EVAL_ORDER=5 mixer with GPTQ","rollback_reason":"ngram sliding eval slow; wrapper 600s too tight","next_action_hint":"Increase timeout to 1200s; also NGRAM requires SLIDING_WINDOW_ENABLED=1"}}
{"run":35,"commit":"c39394b","metric":0,"metrics":{"steps":0,"train_loss":0,"step_avg_ms":0,"peak_memory_mb":0,"submission_bytes":0,"train_time_ms":0},"status":"crash","description":"LZP requires SLIDING_WINDOW_ENABLED=1. Fail fast.","timestamp":1777370416423,"segment":0,"confidence":3.5943140206530937,"iterationTokens":4934,"asi":{"hypothesis":"LZP eval alone","rollback_reason":"LZP requires sliding window","next_action_hint":"Enable SLIDING_WINDOW_ENABLED=1 with LZP"}}
{"run":36,"commit":"c39394b","metric":1.42563446,"metrics":{"steps":1368,"train_loss":2.3482,"step_avg_ms":210.59,"peak_memory_mb":1588,"submission_bytes":12565080,"train_time_ms":288089},"status":"discard","description":"SLIDING_WINDOW_ENABLED=1 + LZP_ENABLED=1 + GPTQ. Primary BPB 1.42563 (vs 1.42353 best GPTQ, noise-level worse). Eval-only features don't change training artifact. Sliding-window roundtrip gave 1.39335, sliding+LZP mix gave 1.37507 (but these aren't the primary metric per autoresearch.md). Full eval took 2360s (huge sliding-window cost).","timestamp":1777372809595,"segment":0,"confidence":3.58628681352647,"iterationTokens":1096,"asi":{"hypothesis":"Sliding window + LZP mixer as eval-only feature","sliding_window_bpb":1.39335,"sliding_lzp_mix_bpb":1.37507,"lzp_coverage":0.973,"lzp_hit_rate":0.561,"eval_time_s":2072,"rollback_reason":"eval-only feature, primary metric noise-level worse","next_action_hint":"Skip multi-hour sliding-window features; pivot to fast training-time features"}}
{"run":37,"commit":"c39394b","metric":0,"metrics":{"steps":1300,"train_loss":2.3414,"step_avg_ms":221.7,"peak_memory_mb":1687,"submission_bytes":12565018,"train_time_ms":288204},"status":"crash","description":"XSA_LAST_N=3 + GPTQ. Training finished in 288s (val_bpb 1.4252 pre-roundtrip), but wrapper 600s ran out before final GPTQ roundtrip_exact could be logged. XSA changes architecture → compile kicked in again for eval.","timestamp":1777373437099,"segment":0,"confidence":3.58628681352647,"iterationTokens":4841,"asi":{"hypothesis":"XSA last-N attention refinement","pre_roundtrip_val_bpb":1.4252,"rollback_reason":"wrapper timeout too tight","next_action_hint":"Use 900s wrapper timeout for architecture-changing experiments"}}
{"run":38,"commit":"c39394b","metric":1.42577685,"metrics":{"steps":1307,"train_loss":2.3423,"step_avg_ms":220.36,"peak_memory_mb":1685,"submission_bytes":12565708,"train_time_ms":288007},"status":"discard","description":"XSA_LAST_N=3 + GPTQ. BPB 1.42578 vs 1.42353 best (+0.002, noise-level worse). XSA adds attn-residual modes to last N recurrent blocks; step time 220ms vs 210ms (slower), step count 1307 vs 1340. Net marginal-negative.","timestamp":1777374053188,"segment":0,"confidence":5.589320963301677,"iterationTokens":5143,"asi":{"hypothesis":"XSA adds cross-slot attention pattern on last 3 core blocks","rollback_reason":"marginal worse at 1.426 vs 1.424","next_action_hint":"Try XSA_LAST_N=2 or =1; or combine with parallel residual"}}
{"run":39,"commit":"c39394b","metric":1.42766003,"metrics":{"steps":1312,"train_loss":2.3448,"step_avg_ms":219.68,"peak_memory_mb":1613,"submission_bytes":12648806,"train_time_ms":288214},"status":"discard","description":"LAUREL_SCOPE=coda LAUREL_RANK=32 + GPTQ. BPB 1.42766 vs 1.42353 best (+0.004 worse). LAuReL low-rank residual added to coda didn't help. Artifact +84KB larger.","timestamp":1777374645073,"segment":0,"confidence":6.1277566493902365,"iterationTokens":1589,"asi":{"hypothesis":"LAuReL low-rank residual on coda blocks","rollback_reason":"slightly worse BPB and larger artifact","next_action_hint":"Try LAUREL_SCOPE=all or higher rank; or skip"}}
{"run":40,"commit":"052d362","metric":1.42201464,"metrics":{"steps":1363,"train_loss":2.3425,"step_avg_ms":211.45,"peak_memory_mb":1588,"submission_bytes":12562712,"train_time_ms":288202},"status":"keep","description":"RESIDUAL_MODE=parallel on core blocks + GPTQ. BPB 1.42201 vs 1.42353 (-0.0015). Same step count (1363) and step time (211ms) — parallel residual is free and helps slightly. New best.","timestamp":1777375250886,"segment":0,"confidence":6.780989236276234,"iterationTokens":1478,"asi":{"hypothesis":"Parallel residual on core blocks allows attn+mlp to run in parallel given same normalized x, potentially improving gradient flow","delta_bpb":-0.00152,"next_action_hint":"Try PARALLEL_RESIDUAL_SCOPE=all. Stack with next promising features."}}
{"run":41,"commit":"052d362","metric":1.42613223,"metrics":{"steps":1371,"train_loss":2.348,"step_avg_ms":210.19,"peak_memory_mb":1588,"submission_bytes":12565009,"train_time_ms":288169},"status":"discard","description":"PARALLEL_RESIDUAL_SCOPE=all (vs core). BPB 1.42613 vs 1.42201 current best (+0.004 worse). Extending parallel residual beyond core (into prelude/coda) hurts.","timestamp":1777375844527,"segment":0,"confidence":10.602233308999494,"iterationTokens":1674,"asi":{"hypothesis":"Parallel residual in all scopes","rollback_reason":"worse than core-only","next_action_hint":"Keep SCOPE=core only"}}
{"run":42,"commit":"052d362","metric":1.43261044,"metrics":{"steps":1362,"train_loss":2.3511,"step_avg_ms":211.57,"peak_memory_mb":1588,"submission_bytes":12572463,"train_time_ms":288159},"status":"discard","description":"MUON_WD=0.04 (vs default 0.095). BPB 1.43261 vs 1.42201 current best (+0.01 worse). Lower weight decay hurts here; default 0.095 is better for our config.","timestamp":1777376450788,"segment":0,"confidence":19.2159356033245,"iterationTokens":1478,"asi":{"hypothesis":"Reduced Muon weight decay as per some leaderboard entries","rollback_reason":"worse by 0.01 BPB","next_action_hint":"Keep MUON_WD=0.095"}}
{"run":43,"commit":"db10baf","metric":1.42144401,"metrics":{"steps":1364,"train_loss":2.3413,"step_avg_ms":211.17,"peak_memory_mb":1588,"submission_bytes":12510910,"train_time_ms":288036},"status":"keep","description":"MUON_MOMENTUM=0.90 (vs default 0.95) on top of parallel residual core + GPTQ. BPB 1.42144 vs 1.42201 (-0.0006). Small win; also -52KB artifact. New best.","timestamp":1777377051715,"segment":0,"confidence":22.185969902345175,"iterationTokens":1474,"asi":{"hypothesis":"Lower Muon momentum 0.90 vs 0.95","delta_bpb":-0.0006,"next_action_hint":"Try MUON_MOMENTUM=0.85 to see if trend continues"}}
{"run":44,"commit":"1230864","metric":1.42051443,"metrics":{"steps":1365,"train_loss":2.3352,"step_avg_ms":211.11,"peak_memory_mb":1588,"submission_bytes":12447006,"train_time_ms":288168},"status":"keep","description":"MUON_MOMENTUM=0.85 (vs 0.90 prev). BPB 1.42051 vs 1.42144 (-0.0009). Consistent trend: lower momentum helps. Also smaller artifact (12.45 vs 12.51MB). New best.","timestamp":1777377664531,"segment":0,"confidence":25.31536255255248,"iterationTokens":1874,"asi":{"hypothesis":"Even lower Muon momentum 0.85","delta_bpb":-0.0009,"next_action_hint":"Try MUON_MOMENTUM=0.80 to see if trend continues"}}
{"run":45,"commit":"1230864","metric":1.4238834,"metrics":{"steps":1357,"train_loss":2.3403,"step_avg_ms":212.24,"peak_memory_mb":1588,"submission_bytes":12408128,"train_time_ms":288007},"status":"discard","description":"MUON_MOMENTUM=0.80 (vs 0.85 best). BPB 1.42388 vs 1.42051 (+0.003 worse). 0.85 is local optimum for this config.","timestamp":1777378276265,"segment":0,"confidence":25.7703311303577,"iterationTokens":1620,"asi":{"hypothesis":"Even lower Muon momentum 0.80","rollback_reason":"worse than 0.85","next_action_hint":"Stick with 0.85"}}
{"run":46,"commit":"1230864","metric":1.42170343,"metrics":{"steps":1357,"train_loss":2.3366,"step_avg_ms":212.36,"peak_memory_mb":1588,"submission_bytes":12447320,"train_time_ms":288170},"status":"discard","description":"SwiGLU reinjection scale=0.02. BPB 1.42170 vs 1.42051 (+0.001 worse). Nonlinear reinjection doesn't help even at small scale.","timestamp":1777378888894,"segment":0,"confidence":26.65595895161114,"iterationTokens":1504,"asi":{"hypothesis":"SwiGLU nonlinear reinjection at small scale","rollback_reason":"slightly worse BPB","next_action_hint":"Swiglu-add feature tested; move on"}}
{"type":"config","name":"Parcae SP1024 int6_rans BPB sweep on RTX Pro 4500 Blackwell ~300s wall-clock, 16MB total artifact ceiling. Systematic feature-by-feature coverage plus SP1892/Scylla tokenizer AoE. Current best tracker: int6_rans_zlib evaluated via autoresearch.sh primary metric parser. Target: test all toggles and log every tokenizer/configuration variant exactly once with 300s wall-clock cap. No hand-analysis during run loop; only pure experiment dispatch, fast result ingestion, and immediate next-step selection based on BPB delta alone (keep if lower, discard if higher or nan). Artifact budget hard ceiling: 16 MB (code+model). eval-only slow paths (sliding window eval >300s, TTT >300s) receive 1200s wrapper timeout but are logged as crash if they exceed because training overhead must stay within scope.","metricName":"val_bpb","metricUnit":"","bestDirection":"lower"}
{"run":47,"commit":"5cb5f47","metric":1.43469617,"metrics":{"peak_memory_mb":1610,"step_avg_ms":203.03,"steps":1419,"submission_bytes":12442344,"train_loss":2.4052,"train_time_ms":288097},"status":"keep","description":"Fresh HEAD baseline on SP1024, 300s wall-clock, parallel residual core + Muon momentum 0.85 + GPTQ int8. This establishes the current code baseline on current HEAD (57b7c19) before systematic feature sweep. Steps 1419, step 203ms, BPB 1.4347.","timestamp":1777446958936,"segment":1,"confidence":null,"iterationTokens":186,"asi":{"hypothesis":"Re-establish baseline on current HEAD after init_experiment reset. Parallel residual core + Muon 0.85 + GPTQ int8. SWA on.","baseline_tightness":"mid_1.43s"}}
{"run":48,"commit":"613d5e1","metric":1.43625301,"metrics":{"peak_memory_mb":1611,"step_avg_ms":201.22,"steps":1491,"submission_bytes":9002499,"train_loss":2.4077,"train_time_ms":300015},"status":"keep","description":"int6_rans quantization (QUANT_BITS=6 RANS_INT6=1) on SP1024 with parallel residual core + Muon 0.85. BPB 1.43625 vs int8 GPTQ 1.43470 baseline (slightly worse) but artifact drops from 12.4MB to 9.0MB. Headroom freed for larger model.","timestamp":1777447684268,"segment":1,"confidence":null,"iterationTokens":1110,"asi":{"artifact_mb":9,"hypothesis":"int6 RANS quantization on SP1024. First int6_rans data point under new metric definition."}}
{"run":49,"commit":"613d5e1","metric":1.44806049,"metrics":{"peak_memory_mb":1884,"step_avg_ms":255.77,"steps":1173,"submission_bytes":11514463,"train_loss":2.3739,"train_time_ms":300019},"status":"discard","description":"MODEL_DIM=448 + int6_rans. BPB 1.44806 vs 1.43625 at dim=384 int6_rans (worse). Step time 255ms vs 201ms (27% slower), steps 1173 vs 1491. Scaling up with int6_rans still underperforms because compression heaviness. Discard.","timestamp":1777448531505,"segment":1,"confidence":null,"iterationTokens":1033,"asi":{"artifact_mb":11.5,"delta_steps":-318,"hypothesis":"Scale MODEL_DIM 384→448 with int6_rans to absorb 3MB freed from smaller quantization"}}
{"run":50,"commit":"613d5e1","metric":1.43818364,"metrics":{"peak_memory_mb":1642,"step_avg_ms":204.52,"steps":1467,"submission_bytes":9144997,"train_loss":2.4137,"train_time_ms":300030},"status":"discard","description":"QAT_BITS=6 + int6_rans export on SP1024. BPB 1.43818 vs 1.43625 non-QAT int6_rans baseline (worse by 0.002). Also artifact increased 9.14MB vs 9.00MB. QAT fake-quant with default group size=32 doesn't improve int6_rans compression on this architecture.","timestamp":1777451444555,"segment":1,"confidence":null,"iterationTokens":282,"asi":{"artifact_mb":9.14,"hypothesis":"QAT_BITS=6 + int6_rans export. Expectation: QAT adapts weights for 6-bit during training, improving final int6_rans BPB vs naive int6_rans"}}
{"run":51,"commit":"258239d","metric":1.4334149,"metrics":{"peak_memory_mb":1611,"step_avg_ms":201.56,"steps":1489,"submission_bytes":9012150,"train_loss":2.4067,"train_time_ms":300126},"status":"keep","description":"SWA_DYNAMIC=1 on int6_rans. BPB 1.43341 vs 1.43625 baseline (-0.003). Dynamic weighting of checkpoints helps. Keep.","timestamp":1777452937668,"segment":1,"confidence":0.6636538332046523,"iterationTokens":10330,"asi":{"artifact_mb":9.01,"delta_bpb":-0.00284,"hypothesis":"SWA_DYNAMIC=1 enables exponentially-weighted averaging that favors recent checkpoints, giving more weight to later converged weights"}}
{"run":52,"commit":"258239d","metric":1.44791926,"metrics":{"peak_memory_mb":1880,"step_avg_ms":255.5,"steps":1175,"submission_bytes":11520812,"train_loss":2.3757,"train_time_ms":300207},"status":"discard","description":"GRADIENT_CHECKPOINTING=1 MODEL_DIM=448 on int6_rans. BPB 1.44792 vs 1.43341 (-0.0145 worse). Step time 255ms vs 202ms, steps 1175 vs 1489. Gradient checkpoint overhead not worth it at dim=448.","timestamp":1777453784146,"segment":1,"confidence":0.40510751583255855,"iterationTokens":1167,"asi":{"artifact_mb":11.5,"delta_steps":-314,"hypothesis":"Gradient checkpointing with MODEL_DIM=448 on int6_rans. Hoped to trade step time for larger model, but step time 255ms too slow, only 1175 steps in 300s. BPB worse."}}
{"run":53,"commit":"258239d","metric":1.43352336,"metrics":{"peak_memory_mb":1611,"step_avg_ms":202.28,"steps":1484,"submission_bytes":9012158,"train_loss":2.404,"train_time_ms":300177},"status":"discard","description":"SWA_START_FRAC=0.25. BPB 1.43352 vs 0.20's 1.43341 (+0.0001). Effectively unchanged. Keep default 0.2.","timestamp":1777455292660,"segment":1,"confidence":0.469389848515373,"iterationTokens":589,"asi":{"delta_bpb":0.00011,"hypothesis":"SWA_START_FRAC=0.25 vs 0.20 on int6_rans+swa_dynamic. Marginal difference, not an improvement."}}
{"run":54,"commit":"258239d","metric":1.43665664,"metrics":{"peak_memory_mb":1611,"step_avg_ms":203.26,"steps":1476,"submission_bytes":9016852,"train_loss":2.4111,"train_time_ms":300018},"status":"discard","description":"SWA_EVERY=25 (vs 50). BPB 1.43666 vs 1.43341 (+0.003). More frequent updates hurt slightly. Keep default 50.","timestamp":1777456128882,"segment":1,"confidence":0.5463698156976775,"iterationTokens":1115,"asi":{"hypothesis":"More frequent SWA updates (every 25 steps vs 50) might average in too much noise from early-mid training"}}
{"run":55,"commit":"258239d","metric":1.43835894,"metrics":{"peak_memory_mb":1611,"step_avg_ms":211,"steps":1422,"submission_bytes":9012654,"train_loss":2.4033,"train_time_ms":300040},"status":"discard","description":"OUTER_ROPE_DIMS=32 RECURRENT_ROPE_DIMS=0 (no recurrent RoPE). BPB 1.43836 vs baseline 1.43341 (+0.005). Recurrent blocks need RoPE. Discard.","timestamp":1777457649955,"segment":1,"confidence":0.6535524644600561,"iterationTokens":437,"asi":{"hypothesis":"OUTER_ROPE_DIMS=32 RECURRENT_ROPE_DIMS=0. Applies RoPE only to prelude/coda; recurrent blocks use no RoPE. Worse."}}
{"run":56,"commit":"d0b8bf4","metric":1.4170943,"metrics":{"peak_memory_mb":1640,"step_avg_ms":205.65,"steps":1459,"submission_bytes":9231905,"train_loss":2.7524,"train_time_ms":300043},"status":"keep","description":"SP1892 tokenizer on same config (parallel residual, Muon 0.85, int6_rans, SWA_dynamic). BPB 1.41709 vs SP1024's 1.43341 (-0.016). SP1892 is significantly better for this architecture under int6_rans.","timestamp":1777459283290,"segment":1,"confidence":7.280148399984859,"iterationTokens":45960,"asi":{"artifact_mb":9.23,"delta_bpb":-0.01632,"hypothesis":"SP1892 tokenizer with same architecture config (dim=384, batch=131k, parallel residual, Muon 0.85, int6_rans). Larger vocab (1892 vs 1024) gives better byte-level compression efficiency despite higher cross-entropy loss because tokens are more byte-efficient."}}
{"run":57,"commit":"bd0066a","metric":1.41213235,"metrics":{"peak_memory_mb":1479,"step_avg_ms":189.25,"steps":1586,"submission_bytes":8131603,"train_loss":2.7451,"train_time_ms":300157},"status":"keep","description":"SP1892 + MLP_MULT=3. BPB 1.41213 vs MLP_MULT=4's 1.41709 (-0.005). Step time 189ms vs 206ms, steps 1586 vs 1459. Much smaller artifact (8.13MB). All metrics better.","timestamp":1777460527781,"segment":1,"confidence":8.266195299763625,"iterationTokens":962,"asi":{"artifact_mb":8.13,"delta_steps":127,"hypothesis":"MLP_MULT=3 on SP1892 with int6_rans. Smaller MLP allows more steps in 300s, and SP1892's byte efficiency means less MLP capacity still gets good compression. Artifact now has 8MB headroom under 16MB."}}
{"run":58,"commit":"bd0066a","metric":1.42572124,"metrics":{"peak_memory_mb":1325,"step_avg_ms":172.55,"steps":1739,"submission_bytes":6944089,"train_loss":2.7632,"train_time_ms":300067},"status":"discard","description":"MLP_MULT=2 on SP1892 int6_rans. BPB 1.42572 vs MLP_MULT=3's 1.41213 (+0.014). Too underpowered. Keep MLP_MULT=3.","timestamp":1777461331446,"segment":1,"confidence":8.068015875853732,"iterationTokens":1365,"asi":{"delta_bpb":0.01359,"hypothesis":"MLP_MULT=2 on SP1892 int6_rans. Too small MLP capacity underfits despite more steps (1739 vs 1586)."}}
{"run":59,"commit":"bd0066a","metric":1.42895101,"metrics":{"peak_memory_mb":1706,"step_avg_ms":222.14,"steps":1351,"submission_bytes":9072629,"train_loss":2.7936,"train_time_ms":300110},"status":"discard","description":"N_LAYERS_IN_RECURRENT_BLOCK=4 on SP1892 int6_rans+MLP3. BPB 1.42895 vs block=3's 1.41213 (+0.017). Slower and worse. Keep 3.","timestamp":1777463237319,"segment":1,"confidence":6.160315826546515,"iterationTokens":51635,"asi":{"hypothesis":"N_LAYERS_IN_RECURRENT_BLOCK=4 on SP1892 int6_rans. More core layers (4 vs 3) slow step time 222ms vs 189ms, steps 1351 vs 1586. Worse BPB."}}
{"run":60,"commit":"bd0066a","metric":1.41631971,"metrics":{"peak_memory_mb":1479,"step_avg_ms":188,"steps":1596,"submission_bytes":8082036,"train_loss":2.7531,"train_time_ms":300041},"status":"discard","description":"LeakyReluSquaredMLP on SP1892 int6_rans+MLP3. BPB 1.41632 vs BaseMLP 1.41213 (+0.004). Not an improvement for SP1892.","timestamp":1777463980925,"segment":1,"confidence":4.79676613240104,"iterationTokens":51635,"asi":{"artifact_mb":8.08,"hypothesis":"LeakyReluSquaredMLP replaces BaseMLP (gelu). Faster (188ms vs 189ms), more steps (1596 vs 1586), but BPB slightly worse (1.416 vs 1.412)."}}
{"run":61,"commit":"bd0066a","metric":1.43414845,"metrics":{"peak_memory_mb":1480,"step_avg_ms":178.62,"steps":1680,"submission_bytes":8142092,"train_loss":2.7531,"train_time_ms":300081},"status":"discard","description":"TRAIN_SEQ_LEN=512 on SP1892 int6_rans+MLP3. BPB 1.43415 vs 1024's 1.41213 (+0.022). Worse. Keep seq_len=1024.","timestamp":1777464851383,"segment":1,"confidence":5.358953470973464,"iterationTokens":1279,"asi":{"hypothesis":"TRAIN_SEQ_LEN=512 on SP1892 int6_rans. Worse than 1024 by significant margin (-0.022 BPB). Model underfits faster tokens."}}
{"run":62,"commit":"85d66b0","metric":1.41183571,"metrics":{"peak_memory_mb":1479,"step_avg_ms":188.33,"steps":1593,"submission_bytes":8128141,"train_loss":2.7444,"train_time_ms":300008},"status":"keep","description":"EMBED_LR=0.3 on SP1892 int6_rans+MLP3. BPB 1.41184 vs 1.41213 (-0.0003). Small keep.","timestamp":1777466278897,"segment":1,"confidence":4.859827826099857,"iterationTokens":758,"asi":{"delta_bpb":-0.00029,"hypothesis":"Lower EMBED_LR=0.3 vs default 0.6. Slight improvement; embedding step size matters for SP1892 tokenizer"}}
