{"run":94,"commit":"fd5b3ec","metric":1.26178148,"metrics":{"steps":3757,"step_avg_ms":147.76,"submission_bytes":19298581,"train_loss":2.6252,"peak_memory_mb":17494,"train_time_ms":555138},"status":"discard","description":"BIGRAM_HASH_DIM 128→96 at 16k buckets/8 heads. Smaller/faster than best but BPB worsened 1.25792→1.26178, so keep dim 128.","timestamp":1777605705262,"segment":1,"confidence":9.764156602216667,"asi":{"hypothesis":"Reduce hash embedding dim to 96 to recover throughput/artifact while keeping most of the bigram capacity benefit.","rollback_reason":"Primary BPB worsened by +0.00387; hash embedding dimension 128 carries useful capacity.","next_action_hint":"Restore dim 128; try intermediate bucket count or optimizer/SWA around big-hash best."}}
{"run":95,"commit":"bd0adc8","metric":1.25979308,"metrics":{"steps":3621,"step_avg_ms":153.29,"submission_bytes":22163732,"train_loss":2.6659,"peak_memory_mb":17534,"train_time_ms":555061},"status":"discard","description":"BIGRAM_HASH_SCALE_INIT 0.05→0.08 on big-hash best. BPB worsened 1.25792→1.25979; default smaller hash injection scale is better.","timestamp":1777606342564,"segment":1,"confidence":9.553633442391254,"asi":{"hypothesis":"Larger initial bigram hash scale may let the enlarged hash table contribute earlier in the 10min budget.","rollback_reason":"Primary BPB worsened by +0.00188; stronger initial hash injection likely destabilizes/overweights hash features.","next_action_hint":"Restore scale 0.05; maybe try smaller 0.03 or optimizer learning rates."}}
{"run":96,"commit":"6f299a3","metric":1.25697863,"metrics":{"steps":3635,"step_avg_ms":152.7,"submission_bytes":22151451,"train_loss":2.6627,"peak_memory_mb":17534,"train_time_ms":555081},"status":"keep","description":"MUON_WD 0.105→0.095 on 8xH100 CaseOps/SP8192 big-hash config. BPB improves 1.25792→1.25698 with similar throughput/artifact; keep.","timestamp":1777606977496,"segment":1,"confidence":9.401601870612526,"asi":{"hypothesis":"Slightly lower Muon weight decay may fit the larger bigram-hash capacity better than 0.105 while preserving regularization."}}
{"run":97,"commit":"dcc7cdd","metric":1.24891059,"metrics":{"steps":3613,"step_avg_ms":153.66,"submission_bytes":22187924,"train_loss":2.6521,"peak_memory_mb":17534,"train_time_ms":555159},"status":"keep","description":"MUON_WD 0.095→0.085 on 8xH100 CaseOps/SP8192 big-hash. Large BPB improvement 1.25698→1.24891 with similar speed; lower WD is much better in this high-capacity config.","timestamp":1777607615906,"segment":1,"confidence":8.960707767578473,"asi":{"hypothesis":"Continue lowering Muon weight decay for the high-capacity bigram-hash setup; previous 0.095 improved over 0.105, so optimum may be lower."}}
{"run":98,"commit":"22ecafc","metric":1.24596232,"metrics":{"steps":3634,"step_avg_ms":152.75,"submission_bytes":22285203,"train_loss":2.6488,"peak_memory_mb":17534,"train_time_ms":555097},"status":"keep","description":"MUON_WD 0.085→0.075 on big-hash CaseOps. BPB improves further 1.24891→1.24596 with similar speed; keep and continue WD sweep downward.","timestamp":1777608251125,"segment":1,"confidence":8.364445825219306,"asi":{"hypothesis":"Weight decay optimum remains lower; high-capacity CaseOps bigram-hash model benefits from less Muon regularization."}}
{"run":99,"commit":"fb182fc","metric":1.24389774,"metrics":{"steps":3611,"step_avg_ms":153.7,"submission_bytes":22331344,"train_loss":2.6514,"peak_memory_mb":17534,"train_time_ms":555022},"status":"keep","description":"MUON_WD 0.075→0.065 on big-hash CaseOps. BPB improves 1.24596→1.24390; keep, trend still positive.","timestamp":1777608888370,"segment":1,"confidence":8.144020157042556,"asi":{"hypothesis":"Continue lowering Muon WD; high-capacity CaseOps setup may be over-regularized at prior values."}}
{"run":100,"commit":"ec161f3","metric":0,"metrics":{"steps":0,"step_avg_ms":0,"submission_bytes":0,"train_loss":0,"peak_memory_mb":0,"train_time_ms":0},"status":"crash","description":"MUON_WD=0.05 run was aborted by user before measurable output while checking GPU state.","timestamp":1777609052366,"segment":1,"confidence":8.144020157042556,"asi":{"hypothesis":"Continue downward Muon WD sweep from 0.065 to 0.05; trend has improved repeatedly in big-hash 8xH100 CaseOps config.","rollback_reason":"User interruption before completion; no result.","next_action_hint":"Rerun the same MUON_WD=0.05 hypothesis now that GPUs are confirmed idle."}}
{"run":101,"commit":"fec1377","metric":1.24465002,"metrics":{"steps":3596,"step_avg_ms":154.35,"submission_bytes":22397191,"train_loss":2.757,"peak_memory_mb":17534,"train_time_ms":555036},"status":"discard","description":"MUON_WD 0.065→0.05 on oversized big-hash config improved vs many prior runs but is invalid for stated artifact constraint: submission 22.40MB > 16MB. Discard despite BPB because model must be <=16MB compressed.","timestamp":1777609708412,"segment":1,"confidence":7.854288979288071,"asi":{"hypothesis":"Continue downward Muon WD sweep from 0.065 to 0.05 in big-hash config; trend may improve BPB.","rollback_reason":"User clarified compressed model/submission must be <=16MB; this config is 22.4MB, over budget, so cannot keep despite BPB.","next_action_hint":"Restore under-budget config; target <=16MB by reducing hash capacity (e.g. 8192 buckets x 8 heads was 16.26MB slightly over; try 8192 buckets with 7 heads or dim 120, or 12288 buckets x 6 heads) while keeping WD tuning."}}
{"run":102,"commit":"e95df98","metric":1.24944457,"metrics":{"steps":4222,"step_avg_ms":131.47,"submission_bytes":15706907,"train_loss":2.6474,"peak_memory_mb":17461,"train_time_ms":555074},"status":"keep","description":"Under-16MB config: BIGRAM_HASH_BUCKETS=8192, HEADS=7, MUON_WD=0.065. Submission 15.71MB and BPB 1.24944, valid and much better than previous under-budget best 1.26783-ish/16.26MB-over.","timestamp":1777610337309,"segment":1,"confidence":7.769742914276201,"asi":{"hypothesis":"Fit the useful bigram hash capacity under the <=16MB constraint by reducing from oversized 16k/8 heads to 8k/7 heads, while retaining lower Muon WD=0.065 found beneficial."}}
{"run":103,"commit":"e017fed","metric":1.24799345,"metrics":{"steps":4275,"step_avg_ms":129.84,"submission_bytes":16079522,"train_loss":2.626,"peak_memory_mb":17464,"train_time_ms":555049},"status":"discard","description":"BIGRAM_HASH_HEADS=8 with DIM=120 nearly improves BPB to 1.24799 but submission is 16,079,522 bytes, slightly above 16MB constraint; discard as over budget.","timestamp":1777610973726,"segment":1,"confidence":7.686997626599823,"asi":{"hypothesis":"Use 8 hash heads but reduce hash dim to 120 to fit under 16MB while improving BPB over 7x128.","rollback_reason":"Submission 16,079,522 bytes exceeds <=16MB constraint by about 80KB, so invalid despite better BPB.","next_action_hint":"Try BIGRAM_HASH_DIM=112 with 8 heads, or keep 7x128 if dim reduction hurts too much."}}
{"run":104,"commit":"f797685","metric":1.24892442,"metrics":{"steps":4184,"step_avg_ms":132.68,"submission_bytes":15722609,"train_loss":2.6172,"peak_memory_mb":17458,"train_time_ms":555127},"status":"keep","description":"BIGRAM_HASH_HEADS=8 DIM=112 under 16MB. Improves valid best 1.24944→1.24892 with submission 15.72MB. Keep; 8 heads worth it if dim is reduced enough.","timestamp":1777611603825,"segment":1,"confidence":7.294736544292765,"asi":{"hypothesis":"Reduce hash dim to 112 so 8 hash heads fit under the <=16MB constraint while retaining more multi-head hash expressiveness than 7x128."}}
{"run":105,"commit":"609d68a","metric":0,"metrics":{"steps":0,"step_avg_ms":0,"submission_bytes":0,"train_loss":0,"peak_memory_mb":0,"train_time_ms":0},"status":"crash","description":"BIGRAM_HASH_DIM=116 under-budget refinement was aborted before measurable output.","timestamp":1777612065280,"segment":1,"confidence":7.294736544292765,"asi":{"hypothesis":"Interpolate between valid 8x112 (15.72MB, 1.24892) and invalid 8x120 (16.08MB, 1.24799); DIM=116 may fit under 16MB and improve BPB.","rollback_reason":"User interruption before completion; no result.","next_action_hint":"Rerun the same BIGRAM_HASH_DIM=116 hypothesis."}}
