{"type":"config","name":"Parcae BPB optimization on RTX Pro 4500 Blackwell","metricName":"val_bpb","metricUnit":"","bestDirection":"lower"}
{"run":1,"commit":"dc55266","metric":1.70650304,"metrics":{},"status":"keep","description":"Baseline: current code on SP1024, 300s, all new features off (MHC=none, EMA=0, SWA=0, POE=1). Much better than 1.762 noted in autoresearch.md — codebase has evolved.","timestamp":1777194757513,"segment":0,"confidence":null,"iterationTokens":null}
{"run":2,"commit":"dc55266","metric":1.68845433,"metrics":{"steps":3123,"train_loss":2.7821,"step_avg_ms":96.1,"peak_memory_mb":515,"submission_bytes":4657664},"status":"keep","description":"Enable COMPILE_MODEL=1 on Blackwell. Steps jumped 1983→3123 (+57%), BPB improved 1.7065→1.6885 (-0.018). Compile gave massive throughput gain.","timestamp":1777195350130,"segment":0,"confidence":null,"iterationTokens":2417,"asi":{"hypothesis":"torch.compile on Blackwell significantly improves step throughput, allowing more training in same wall-clock and thus better BPB"}}
{"run":3,"commit":"dc55266","metric":1.68968778,"metrics":{"peak_memory_mb":452,"step_avg_ms":100,"steps":2998,"submission_bytes":4662877,"train_loss":2.9209},"status":"discard","description":"Stack COMPILE_MUON_BACKEND=1 on top of COMPILE_MODEL=1. BPB 1.6897 (slightly worse than 1.6885), steps 2998 < 3123. Muon backend compile adds overhead without benefit.","timestamp":1777195862382,"segment":0,"confidence":14.632705014388415,"iterationTokens":792,"asi":{"hypothesis":"COMPILE_MUON_BACKEND=1 adds overhead; worse steps and BPB than COMPILE_MODEL=1 alone","next_action_hint":"Keep COMPILE_MODEL=1, revert COMPILE_MUON_BACKEND. Next try other ideas like longer seq len or PoE experts.","rollback_reason":"Steps down 125, BPB up 0.0012"}}
{"run":4,"commit":"16c6986","metric":1.65965664,"metrics":{"peak_memory_mb":452,"step_avg_ms":100.4,"steps":2989,"submission_bytes":4642288,"train_loss":2.8681},"status":"keep","description":"TRAIN_SEQ_LEN=1024 (was 512) with COMPILE_MODEL=1. Massive BPB improvement: 1.688→1.660 (-0.028). Steps 2989 (comparable to seq512+compile's 3123). Longer seq length gives much better context utilization.","timestamp":1777196917657,"segment":0,"confidence":5.19110784094809,"iterationTokens":4186,"asi":{"hypothesis":"Doubling seq len from 512→1024 on Blackwell with torch.compile gives dramatically better BPB via improved context learning per step, without significantly hurting throughput due to compile optimization"}}
{"run":5,"commit":"c634e49","metric":1.63910062,"metrics":{"peak_memory_mb":625,"step_avg_ms":97.9,"steps":3063,"submission_bytes":5562535,"train_loss":2.716},"status":"keep","description":"Scale MODEL_DIM and RECURRENT_DIM from 256→320. BPB 1.660→1.639 (-0.021). Steps 3063. Memory 625MB. Larger model capacity helps a lot with compile.","timestamp":1777197495997,"segment":0,"confidence":3.734472990036372,"iterationTokens":1005,"asi":{"hypothesis":"With compile on Blackwell, larger model (320 vs 256) gives better quality per step without throughput penalty"}}
{"run":6,"commit":"74e5a78","metric":1.6199743,"metrics":{"peak_memory_mb":737,"step_avg_ms":98.5,"steps":3048,"submission_bytes":7199872,"train_loss":2.6847},"status":"keep","description":"Scale MODEL_DIM from 320→384. BPB 1.639→1.620 (-0.019). Steps 3048. Memory 737MB. Compile keeps throughput excellent even at larger sizes.","timestamp":1777198081952,"segment":0,"confidence":3.599376453961443,"iterationTokens":959,"asi":{"hypothesis":"Model scaling continues to yield BPB improvements on Blackwell with compile. Even dim=384 maintains ~3000 steps in 300s."}}
{"run":7,"commit":"4586a43","metric":1.61640158,"metrics":{"peak_memory_mb":852,"step_avg_ms":100,"steps":3001,"submission_bytes":9266585,"train_loss":2.6835},"status":"keep","description":"MODEL_DIM 384→448. Marginal BPB gain: 1.620→1.616 (-0.004). Steps 3001. Submission bytes 9.3MB (+2.1MB). Diminishing returns starting to show.","timestamp":1777198669872,"segment":0,"confidence":3.0002677221044403,"iterationTokens":913,"asi":{"hypothesis":"Model scaling improvement is diminishing: 256→320 gave -0.021, 320→384 gave -0.019, 384→448 gave only -0.004. May be approaching optimal size/quality tradeoff for this budget."}}
{"run":8,"commit":"43ce8e9","metric":1.61306856,"metrics":{"peak_memory_mb":759,"step_avg_ms":104.3,"steps":2877,"submission_bytes":8541592,"train_loss":2.7369},"status":"keep","description":"N_LAYERS_IN_RECURRENT_BLOCK 2→3 with dim=384. BPB 1.620→1.613 (-0.007). Steps 2877 (-171). Submission bytes 8.5MB (+1.3MB). Modest gain, fewer steps due to larger compute per step.","timestamp":1777199279329,"segment":0,"confidence":2.6970230542126803,"iterationTokens":1073,"asi":{"hypothesis":"Adding recurrent depth helps BPB modestly but hurts steps and artifact size. Model width scaling gave better returns than depth scaling."}}
{"run":9,"commit":"b0b08f0","metric":1.60032814,"metrics":{"peak_memory_mb":863,"step_avg_ms":108.9,"steps":2756,"submission_bytes":9884764,"train_loss":2.6654},"status":"keep","description":"MLP_MULT 3→4 with dim=384, 3 recurrent layers. BPB 1.613→1.600 (-0.013). Steps 2756. Submission 9.9MB. Good quality gain from wider MLP.","timestamp":1777199851527,"segment":0,"confidence":4.078620746879057,"iterationTokens":968,"asi":{"hypothesis":"MLP_MULT=4 gives substantial BPB improvement over 3 in this config. Quality gain outweighs throughput loss."}}
{"run":10,"commit":"b0b08f0","metric":1.59855544,"metrics":{"peak_memory_mb":863,"step_avg_ms":123,"steps":2439,"submission_bytes":9915209,"train_loss":2.7516},"status":"discard","description":"MEAN_RECURRENCE 2→3. Marginal BPB 1.600→1.599 (-0.002). Steps dropped 2756→2439. Not worth the throughput loss.","timestamp":1777201111021,"segment":0,"confidence":3.579220779220788,"iterationTokens":568,"asi":{"hypothesis":"Recurrence 3 is barely better than 2 on this config, but costs 11% fewer steps","next_action_hint":"Revert to recurrence=2. Try other axes like QK norm variations, RoPE dims, or gradient clipping.","rollback_reason":"BPB gain 0.002 is marginal vs 11% fewer steps"}}
{"run":11,"commit":"65964bc","metric":1.59789476,"metrics":{"peak_memory_mb":798,"step_avg_ms":111.4,"steps":2693,"submission_bytes":9887021,"train_loss":2.8277},"status":"keep","description":"ROPE_DIMS 16→32 with seq1024. Marginal BPB 1.600→1.598 (-0.002). Steps 2693 (only -63). Small but clean improvement.","timestamp":1777201707637,"segment":0,"confidence":5.070684434185568,"iterationTokens":987,"asi":{"hypothesis":"RoPE 32 slightly better than 16 for seq1024 context, yielding marginal BPB improvement"}}
{"run":12,"commit":"2b76a21","metric":1.59236802,"metrics":{"peak_memory_mb":862,"step_avg_ms":118.9,"steps":2523,"submission_bytes":11380588,"train_loss":2.7706},"status":"keep","description":"N_LAYERS_IN_CODA 1→2. BPB 1.598→1.592 (-0.006). Steps 2523 (-170). Submission 11.4MB. Adding a second coda layer gives substantial quality improvement.","timestamp":1777202829126,"segment":0,"confidence":5.539747016565113,"iterationTokens":489,"asi":{"hypothesis":"Second coda layer provides substantial quality gain in this architecture. Bottleneck may be moving from recurrent to coda depth."}}
{"run":13,"commit":"c76776e","metric":1.59093126,"metrics":{"peak_memory_mb":862,"step_avg_ms":118.6,"steps":2529,"submission_bytes":11375123,"train_loss":2.77},"status":"keep","description":"GRAD_CLIP_NORM=0.3. Marginal BPB 1.592→1.591 (-0.001). Steps 2529. Very small improvement, near noise floor.","timestamp":1777203436064,"segment":0,"confidence":5.0914831640457034,"iterationTokens":1629,"asi":{"hypothesis":"Gradient clipping 0.3 gives marginal (possibly noise) improvement. Worth keeping since it's cheap and safe","next_action_hint":"Try other axes: more warmup, different LR, QK norm off, bigger bigram buckets, or smaller seq to test tradeoffs"}}
{"run":14,"commit":"c2ff9ab","metric":1.58916677,"metrics":{"peak_memory_mb":871,"step_avg_ms":121.5,"steps":2469,"submission_bytes":12388916,"train_loss":2.7445},"status":"keep","description":"BIGRAM_HASH_BUCKETS 4096→8192. BPB 1.591→1.589 (-0.002). Steps 2469 (-60). Submission 12.4MB. Small but consistent improvement.","timestamp":1777203987722,"segment":0,"confidence":5.08269804807622,"iterationTokens":875,"asi":{"hypothesis":"Bigger bigram hash table helps slightly with more capacity for n-gram patterns"}}
{"run":15,"commit":"397671e","metric":1.58771716,"metrics":{"peak_memory_mb":964,"step_avg_ms":124.7,"steps":2407,"submission_bytes":13938131,"train_loss":2.7381},"status":"keep","description":"MLP_MULT 4→5. BPB 1.589→1.588 (-0.001). Steps 2407 (-62). Submission 13.9MB. Very marginal gain vs cost.","timestamp":1777204591688,"segment":0,"confidence":5.365870273249221,"iterationTokens":888,"asi":{"hypothesis":"MLP_MULT=5 barely improves over 4 despite much larger artifact. Diminishing returns from MLP scaling.","next_action_hint":"Revert MLP_MULT to 4 or try 3.5. Instead try increasing model dim further (448 already tried, marginal). Or try training longer with more batch tokens per step."}}
{"run":16,"commit":"fd0d4a7","metric":1.50612585,"metrics":{"peak_memory_mb":870,"step_avg_ms":121,"steps":2480,"submission_bytes":12419528,"train_loss":2.6666},"status":"keep","description":"TRAIN_BATCH_TOKENS 16384→32768. DRAMATIC BPB 1.588→1.506 (-0.082). Steps 2480. Processing 81M tokens vs 41M in 300s. Compile enables much higher throughput, doubling batch size doubles tokens processed.","timestamp":1777205166782,"segment":0,"confidence":12.035146749104403,"iterationTokens":1190,"asi":{"hypothesis":"Doubling batch tokens doubles total tokens trained in 300s (81M vs 41M), massively improving BPB. torch.compile on Blackwell enables large batch sizes without proportional slowdown."}}
{"run":17,"commit":"af803f0","metric":1.44045914,"metrics":{"peak_memory_mb":870,"step_avg_ms":129.6,"steps":2315,"submission_bytes":12439105,"train_loss":2.5509},"status":"keep","description":"TRAIN_BATCH_TOKENS 32768→65536. BPB 1.506→1.440 (-0.066). Steps 2315. Step time only increased 7% (121→130ms) for 2× batch. Compile enables massive throughput.","timestamp":1777205780665,"segment":0,"confidence":16.55177112055666,"iterationTokens":852,"asi":{"hypothesis":"Blackwell compile makes large batch sizes nearly free per-token. Batch=65536 yields ~152M tokens in 300s. Massive BPB improvement from seeing more data."}}
{"run":18,"commit":"9134c71","metric":1.42533274,"metrics":{"peak_memory_mb":1038,"step_avg_ms":135.9,"steps":2207,"submission_bytes":12428063,"train_loss":2.4842},"status":"keep","description":"TRAIN_BATCH_TOKENS 65536→81920. BPB 1.440→1.425 (-0.015). Steps 2207. Peak mem 1038MB. Still improving with larger batch, though gains slowing.","timestamp":1777206461283,"segment":0,"confidence":14.998829092907068,"iterationTokens":1156,"asi":{"hypothesis":"Batch scaling continues to improve BPB. 81920 batch gives ~181M tokens in 300s. Compile amortizes batch overhead very well."}}
{"run":19,"commit":"e13d69f","metric":1.41531285,"metrics":{"peak_memory_mb":1587,"step_avg_ms":203.3,"steps":1476,"submission_bytes":12473934,"train_loss":2.3902},"status":"keep","description":"TRAIN_BATCH_TOKENS 81920→131072. BPB 1.425→1.415 (-0.010). Steps halved to 1476. Total tokens ~193M. Step time 203ms. Still improving but diminishing.","timestamp":1777207103993,"segment":0,"confidence":13.595036804012887,"iterationTokens":1990,"asi":{"hypothesis":"Batch=131072 continues BPB improvement but step time increased significantly (203ms). Diminishing returns setting in. Total tokens ~193M."}}
{"run":20,"commit":"e13d69f","metric":1.41778227,"metrics":{"peak_memory_mb":1412,"step_avg_ms":181.9,"steps":1649,"submission_bytes":12458982,"train_loss":2.4162},"status":"discard","description":"TRAIN_BATCH_TOKENS 131072→114688. BPB 1.415→1.418 (worse). Batch 114688 not as good as 131072. Need to find optimal between 98304 and 131072.","timestamp":1777208315735,"segment":0,"confidence":9.29952868451949,"iterationTokens":490,"asi":{"hypothesis":"114688 batch worse than 131072. Optimum likely near top of range. Try 122880 or 124928.","next_action_hint":"Try batch 122880 or 124928. Also try Scylla tokenizer with optimized config since compile enables massive throughput.","rollback_reason":"BPB worse than 131072: 1.418 vs 1.415"}}
{"run":21,"commit":"e13d69f","metric":1.41597955,"metrics":{"peak_memory_mb":1518,"step_avg_ms":188.4,"steps":1593,"submission_bytes":12460540,"train_loss":2.4034},"status":"discard","description":"TRAIN_BATCH_TOKENS 122880. BPB 1.416 (vs 1.415 at 131072). Batch 131072 remains optimal in tested range.","timestamp":1777209003614,"segment":0,"confidence":7.06671793769138,"iterationTokens":16459,"asi":{"hypothesis":"Batch 122880 gives BPB 1.416, slightly worse than 1.415 at 131072. 131072 seems to be the sweet spot in this range.","next_action_hint":"Stick with batch=131072. Now try Scylla tokenizer with optimized config (batch=131072, compile, dim=384).","rollback_reason":"BPB 1.416 vs 1.415 at 131072"}}
{"run":22,"commit":"7f74996","metric":1.41432089,"metrics":{"peak_memory_mb":1589,"step_avg_ms":203.3,"steps":1476,"submission_bytes":12478919,"train_loss":2.3862},"status":"keep","description":"SWA_ENABLED=1 with SWA_START_FRAC=0.2. BPB 1.415→1.414 (-0.001). Marginal but measurable improvement from weight averaging.","timestamp":1777210411626,"segment":0,"confidence":5.386120104912272,"iterationTokens":19808,"asi":{"hypothesis":"SWA provides marginal BPB improvement (0.001). Worth keeping alongside large batch config."}}
{"run":23,"commit":"7f74996","metric":1.41743211,"metrics":{"peak_memory_mb":1589,"step_avg_ms":203.3,"steps":1476,"submission_bytes":12472083,"train_loss":2.3919},"status":"discard","description":"SWA_START_FRAC 0.2→0.1. BPB 1.417 vs 1.414 at 0.2. Worse result, 0.2 is better.","timestamp":1777212978914,"segment":0,"confidence":4.342222354983666,"iterationTokens":19864,"asi":{"hypothesis":"SWA start frac 0.2 is slightly better than 0.1","next_action_hint":"Keep SWA=0.2. Try other axes: longer warmup, different heads, or higher model dim with lower batch.","rollback_reason":"BPB 1.417 vs 1.414 at SWA=0.2"}}
{"run":24,"commit":"7f74996","metric":1.41631549,"metrics":{"peak_memory_mb":1589,"step_avg_ms":203,"steps":1479,"submission_bytes":12480231,"train_loss":2.3902},"status":"discard","description":"WARMUP_STEPS 500→300. BPB 1.416 (vs 1.414 at 500). Slightly worse.","timestamp":1777214705329,"segment":0,"confidence":3.806170084840969,"iterationTokens":22802,"asi":{"hypothesis":"Warmup 300 gives slightly worse BPB than 500. 500 steps is appropriate for this large batch size.","rollback_reason":"BPB 1.416 vs 1.414 at warmup=500"}}
{"run":25,"commit":"83d27e3","metric":1.41995045,"metrics":{"steps":1479,"submission_bytes":12519584,"train_loss":2.3954,"peak_memory_mb":1589,"step_avg_ms":202.9},"status":"keep","description":"Baseline validation: current code (HEAD 59de6d8, +1000 lines of default-off eval features) reproduces ~1.42 BPB on SP1024 with best config (dim=384, batch=131072, compile=1, SWA=1). Result 1.41995 vs historical best 1.41432 is within noise. All new features (sliding eval, PPM, ngram, TTT, DeepSeek MoE, LAuReL, QAT, GPTQ) are default-off. Validated code is ready for new experiments.","timestamp":1777346711028,"segment":0,"confidence":3.445324419751054,"iterationTokens":22802,"asi":{"hypothesis":"Validate that default-off eval features don't regress training BPB","baseline_bpb":"1.41432089 (run 22)","delta_from_baseline":0.0056,"features_added":"sliding_window, ppm, ngram_eval, ttt, deepseek_moe, laurel, qat, gptq","all_features_default_off":true,"next_action_hint":"Now experiment with PoE on SP1024 or Scylla with large batch"}}
{"run":26,"commit":"8d7e5ae","metric":1.41687818,"metrics":{"steps":1436,"submission_bytes":13247454,"train_loss":2.3838,"peak_memory_mb":1655,"step_avg_ms":208.9},"status":"keep","description":"PoE on SP1024: POE_NUM_EXPERTS=3, POE_HEAD_LR=0.005. Marginal BPB improvement 1.41995→1.41688 (-0.003). Steps 1479→1436 (-3%), submission +0.7MB, memory +66MB. PoE is NOT the huge win on SP1024 that it was on Scylla. Need to try other POE_HEAD_LR values or expert counts.","timestamp":1777347386766,"segment":0,"confidence":3.205008345377535,"iterationTokens":2093,"asi":{"hypothesis":"PoE=3 helps on Scylla but not on SP1024; marginal 0.003 BPB improvement","baseline_bpb":1.41995045,"poe_experts":3,"poe_head_lr":0.005,"next_action_hint":"Try POE_NUM_EXPERTS=2 or different POE_HEAD_LR (0.002, 0.008). Or try Scylla with this config."}}
{"run":27,"commit":"caa1a8f","metric":1.38248893,"metrics":{"steps":2853,"submission_bytes":13170034,"train_loss":2.3202,"peak_memory_mb":1655,"step_avg_ms":210.3,"train_time_ms":600135},"status":"keep","description":"Double wall-clock to 600s (was 300s) with POE=3. MASSIVE BPB improvement 1.4169→1.3825 (-0.034). Steps 1436→2853 (+99%). Training saw ~373M tokens vs ~190M. The primary driver appears to be more training time, not PoE. Need to test POE=1 at 600s to disentangle. Also need to check if challenge target is 300s or 600s; RWKV docs say 10 min target.","timestamp":1777348403224,"segment":0,"confidence":3.263390801425683,"iterationTokens":30930,"asi":{"hypothesis":"Doubling wall-clock from 300s to 600s doubles steps and massively improves BPB. POE=3 may or may not contribute.","baseline_bpb_300s_poe3":1.41687818,"baseline_bpb_300s_poe1":1.41995045,"improvement":0.0344,"total_tokens_est":"373M","next_action_hint":"Test POE=1 at 600s to isolate wall-clock vs PoE effect. Then try other axes at 600s."}}
{"run":28,"commit":"34e4891","metric":1.38339991,"metrics":{"steps":2945,"submission_bytes":12454879,"train_loss":2.3453,"peak_memory_mb":1589,"step_avg_ms":203.8,"train_time_ms":600101},"status":"keep","description":"POE=1 at 600s wall-clock: BPB 1.3834 (vs 1.3825 with POE=3 at 600s). Difference is 0.0009 — POE is not meaningful on SP1024. POE=1 has MORE steps (2945 vs 2853), SMALLER artifact (12.4MB vs 13.2MB), and LOWER memory. Keep POE=1. The real win is 600s wall-clock, not PoE. New best config: dim=384, batch=131k, compile=1, 600s, POE=1, SWA=1.","timestamp":1777349338975,"segment":0,"confidence":3.219885124669216,"iterationTokens":30930,"asi":{"hypothesis":"POE does not help on SP1024 at any budget. The 600s wall-clock is the real breakthrough.","poe1_bpb_600s":1.38339991,"poe3_bpb_600s":1.38248893,"poe1_steps_600s":2945,"poe3_steps_600s":2853,"delta_poe1_vs_poe3":0.0009,"conclusion":"POE irrelevant on SP1024. Keep POE=1 for smaller artifact + more steps.","next_action_hint":"Revert POE=1, keep 600s. Next try model_dim=448 or more recurrent layers at 600s."}}
{"run":29,"commit":"998b022","metric":1.42746826,"metrics":{"steps":1389,"step_avg_ms":216.08,"submission_bytes":12563920,"train_loss":2.3582,"peak_memory_mb":1600,"train_time_ms":300142},"status":"keep","description":"Strict-300s baseline on current HEAD (44c0581) with SWA=1: BPB 1.42747, 1389 steps, 12.6MB. Slightly worse than run 22's 1.41432 (same nominal config) likely from code drift (+1000 lines eval features). New baseline for feature-testing at strict 300s budget.","timestamp":1777357157233,"segment":0,"confidence":3.177524173139279,"iterationTokens":26997,"asi":{"hypothesis":"Re-establish 300s baseline on current HEAD before feature ablations","config":"dim=384 batch=131k compile=1 SWA=1 POE=1 recur=2 core=3 coda=2 mlp=4","drift_from_run22":0.013,"notes":"autoresearch.sh updated to use ${VAR:-default} so inline env var overrides work"}}
{"run":30,"commit":"998b022","metric":1.43118263,"metrics":{"steps":1395,"step_avg_ms":215.11,"submission_bytes":12528069,"train_loss":2.3456,"peak_memory_mb":1651,"train_time_ms":300077},"status":"discard","description":"EMA_ENABLED=1 decay=0.997 replacing SWA. BPB 1.43118 vs 1.42747 (worse by 0.004). Train loss lower (2.346 vs 2.358) but val worse — EMA with this decay is not a clear win at 300s/1400 steps. Effective window ~333 steps = last 24% of training.","timestamp":1777357759919,"segment":0,"confidence":2.755314336211602,"iterationTokens":1858,"asi":{"hypothesis":"EMA with leaderboard-typical decay=0.997 replacing SWA","result_vs_swa":"+0.004 BPB (worse)","train_loss_delta":-0.013,"effective_window_steps":333,"rollback_reason":"EMA decay=0.997 gave worse BPB than SWA baseline","next_action_hint":"Try EMA decay=0.999 (longer window) or EMA+SWA combo. Or try EMA with higher update_every."}}
{"run":31,"commit":"998b022","metric":1.64949808,"metrics":{"steps":1399,"step_avg_ms":214.46,"submission_bytes":12472575,"train_loss":2.3495,"peak_memory_mb":1651,"train_time_ms":300024},"status":"discard","description":"EMA decay=0.999 badly underfits: BPB 1.6495 vs 1.4275 baseline. With only ~1400 training steps, decay=0.999 means EMA barely updates away from init. Effective window 1/(1-0.999)=1000 roughly equals total steps, so avg lags far behind converged weights.","timestamp":1777358352879,"segment":0,"confidence":3.177524173139279,"iterationTokens":1890,"asi":{"hypothesis":"Longer EMA window via decay=0.999","result":"catastrophic underfitting","rollback_reason":"EMA decay=0.999 too conservative for 1400-step regime","next_action_hint":"EMA is fundamentally mismatched to small-step regimes; stick with SWA. Try GPTQ, QAT, gradient checkpointing, or architecture features next."}}
