{"type":"config","name":"Minimize RWKV-7 FineWeb SP1892 val BPB under 5-min / 16-MB INT6","metricName":"val_bpb","metricUnit":"","bestDirection":"lower"}
{"run":1,"commit":"b5bc305","metric":1.52150311,"metrics":{"int6_size_mb":20.53,"train_avg_loss":3.31904639,"train_steps":3258,"val_loss":2.99097339},"status":"keep","description":"Baseline L8-D512 no RoPE no attention. Reproduces ~1.519 BPB from prior run. INT6=20.53MB (exceeds 16MB cap - needs downsizing for actual challenge).","timestamp":1777259762626,"segment":0,"confidence":null,"iterationTokens":3006,"asi":{"baseline_label":"L8-D512-norope-noattn","challenge_note":"trained INT6=20.53MB exceeds 16MB cap - must downsize model or compress better","hypothesis":"reproduce baseline BPB before searching smaller configs","int6_fresh_estimate_mb":12.85,"int6_trained_actual_mb":20.53,"size_limit_ok":false}}
{"run":2,"commit":"94eac9e","metric":1.54470867,"metrics":{"int6_size_mb":14.8,"train_avg_loss":3.37955487,"train_steps":3228,"val_loss":3.03659092},"status":"discard","description":"L10-D384 smaller model. Fits 16MB cap at 14.8MB INT6. BPB=1.545, worse than L8-D512 baseline as expected due to fewer params. Tradeoff: size-safe but lower capacity.","timestamp":1777260409768,"segment":0,"confidence":null,"iterationTokens":20794,"asi":{"challenge_note":"Fits 16MB cap (trained INT6=14.8MB). BPB worse than baseline as expected.","config":"L10-D384","hypothesis":"deeper narrower model fits size cap but loses capacity","int6_trained_actual_mb":14.8,"size_limit_ok":true,"trained_to_fresh_ratio":1.598}}
{"run":3,"commit":"7c5192c","metric":1.53836471,"metrics":{"int6_size_mb":16,"train_avg_loss":3.35694553,"train_steps":3190,"val_loss":3.02411994},"status":"keep","description":"L8-D448 baseline. Val BPB=1.538, trained INT6=16.0MB (right at 16MB cap). Slightly worse BPB than L8-D512 due to fewer params, but fits size limit.","timestamp":1777260946060,"segment":0,"confidence":null,"iterationTokens":20794,"asi":{"challenge_note":"Right at 16MB cap. Best size-safe baseline so far.","config":"L8-D448","hypothesis":"smaller baseline that fits size cap","int6_trained_actual_mb":16,"size_limit_ok":true}}
{"run":4,"commit":"dfecc1b","metric":1.50866567,"metrics":{"int6_size_mb":15.8,"train_avg_loss":3.28851596,"train_steps":3688,"val_loss":2.96573752},"status":"keep","description":"L8-D448 + hybrid attention at layer 4. Val BPB=1.5087 BEATS the larger L8-D512 baseline! Trained INT6=15.8MB (under 16MB cap). Best result by far.","timestamp":1777261453829,"segment":0,"confidence":1.1064107050206986,"iterationTokens":857}
{"run":5,"commit":"23e6a5f","metric":1.4982711,"metrics":{"int6_size_mb":15.6,"train_avg_loss":3.2562658,"train_steps":3955,"val_loss":2.94530386},"status":"keep","description":"L8-D448 + hybrid attention every 3rd layer (layers 3,6). Val BPB=1.4983 beats every-4 config. Two attention anchors helps. INT6=15.6MB under cap. More attention seems beneficial.","timestamp":1777261983952,"segment":0,"confidence":1.3778057835555457,"iterationTokens":795}
{"run":6,"commit":"ea76256","metric":1.49662662,"metrics":{"int6_size_mb":15.4,"train_avg_loss":3.24176049,"train_steps":4208,"val_loss":2.94207113},"status":"keep","description":"L8-D448 + hybrid attention every 2nd layer (layers 2,4,6). Val BPB=1.4966, slight improvement over every-3. Three attention anchors. INT6=15.4MB. More attention continues to help slightly.","timestamp":1777262467433,"segment":0,"confidence":1.410589304659388,"iterationTokens":866}
{"run":7,"commit":"af850b2","metric":1.47849945,"metrics":{"int6_size_mb":14.7,"train_avg_loss":3.13319342,"train_steps":6440,"val_loss":2.90643672},"status":"keep","description":"L8-D448 + ALL attention layers (attn_every=1, layers 1-7). Val BPB=1.4785 massive improvement! 6440 steps in 5min because SDPA is faster than RWKV kernel. INT6=14.7MB. Best result by far.","timestamp":1777262936635,"segment":0,"confidence":3.3498625894259435,"iterationTokens":948}
{"run":8,"commit":"94eac9e","metric":1.48212264,"metrics":{"int6_size_mb":14.1,"train_avg_loss":3.14263042,"train_steps":6685,"val_loss":2.91355919},"status":"discard","description":"L10-D384 + ALL attention. Val BPB=1.4821, slightly worse than L8-D448 all-attn (1.4785). Hidden dim matters more than depth here. INT6=14.1MB.","timestamp":1777263377299,"segment":0,"confidence":2.184009484904579,"iterationTokens":1286}
{"run":9,"commit":"94eac9e","metric":1.49816547,"metrics":{"int6_size_mb":14.6,"train_avg_loss":3.26610658,"train_steps":6489,"val_loss":2.94509622},"status":"discard","description":"L8-D448 all-attention + tie_embeddings=1. Val BPB=1.4982, WORSE than untied (1.4785). Tying hurts here. INT6=14.6MB.","timestamp":1777263803263,"segment":0,"confidence":2.6630192600409157,"iterationTokens":654}
{"run":10,"commit":"94eac9e","metric":1.48758508,"metrics":{"int6_size_mb":14.7,"train_avg_loss":3.15006735,"train_steps":6682,"val_loss":2.92429726},"status":"discard","description":"L8-D448 all-attention WITHOUT attn_rope. Val BPB=1.4876, worse than with attn_rope=1 (1.4785). Attention RoPE is beneficial.","timestamp":1777264216969,"segment":0,"confidence":3.217771060109186,"iterationTokens":131}
{"run":11,"commit":"59de6d8","metric":1.47726852,"metrics":{"int6_size_mb":14.7,"train_avg_loss":3.13049622,"train_steps":6513,"val_loss":2.90401695},"status":"keep","description":"L8-D448 all-attention + larger dim_ffn=2048. Val BPB=1.4773, tiny improvement over dim_ffn=1792 (1.4785). INT6=14.7MB. FFN scaling helps marginally.","timestamp":1777264661168,"segment":0,"confidence":2.7572809784807424,"iterationTokens":1465}
{"run":12,"commit":"94eac9e","metric":1.48755537,"metrics":{"int6_size_mb":14.7,"train_avg_loss":3.16488682,"train_steps":6312,"val_loss":2.92423886},"status":"discard","description":"L8-D448 all-attention + head_size=32. Val BPB=1.4876, WORSE than head_size=64 (1.4773). head_size=64 is better.","timestamp":1777265147593,"segment":0,"confidence":3.3330475081405577,"iterationTokens":1444}
